{
  "plugin_id": "sakuramedia_movie_scrape_translate",
  "display_name": "SakuraMedia 影片文案抓取与翻译",
  "description": "从 DMM 抓取影片的日文标题和简介，可选翻译成中文后写回影片标题与简介。",
  "author": "tinyping",
  "repo": "tinypinglite/sakuramedia_movie_scrape_translate",
  "homepage": "https://github.com/tinypinglite/sakuramedia_movie_scrape_translate",
  "categories": [
    "metadata"
  ],
  "official": true,
  "latest": {
    "version": "0.0.2",
    "host_api_version": 6,
    "download_url": "https://github.com/tinypinglite/sakuramedia_movie_scrape_translate/releases/download/v0.0.2/sakuramedia_movie_scrape_translate-0.0.2.zip",
    "sha256": "3dffe6d82ac9146ea8f3acc18646a68001821520925e074e0d7216d9a137dff9",
    "published_at": "2026-10-25T06:28:16Z"
  }
}
