{
  "plugin_id": "sakuramedia_subtitlecat",
  "display_name": "SakuraMedia SubtitleCat 中文字幕",
  "description": "为已有影片抓取 zh-CN 字幕，支持手动抓取单部影片和定时处理已订阅影片。",
  "author": "tinypinglite",
  "repo": "tinypinglite/sakuramedia_subtitlecat",
  "homepage": "https://github.com/tinypinglite/sakuramedia_subtitlecat",
  "categories": [
    "subtitle"
  ],
  "official": true,
  "latest": {
    "version": "0.2.4",
    "host_api_version": 4,
    "download_url": "https://github.com/tinypinglite/sakuramedia_subtitlecat/releases/download/v0.2.4/sakuramedia_subtitlecat-0.2.4.zip",
    "sha256": "65c35d632a4c8e1acad4efbe4ed91b10ca4643f4540d57298fccde1786b840c7",
    "published_at": "2026-10-25T06:31:30Z"
  }
}
