{
  "plugin_id": "sakuramedia_actor_metadata",
  "display_name": "SakuraMedia 女优资料补全",
  "description": "从 JavDB 和 MinnanoAV 补全本地女优资料，包括生日、身高、三围、罩杯、出生地、血型和性别。",
  "author": "tinypinglite",
  "repo": "tinypinglite/sakuramedia-actor-metadata",
  "homepage": "https://github.com/tinypinglite/sakuramedia-actor-metadata",
  "categories": [
    "metadata"
  ],
  "official": true,
  "latest": {
    "version": "0.0.4",
    "host_api_version": 6,
    "download_url": "https://github.com/tinypinglite/sakuramedia-actor-metadata/releases/download/v0.0.4/sakuramedia_actor_metadata-0.0.4.zip",
    "sha256": "540047794540dc3f1e5366907e018d7cc5289406596bdd4120c1344b152a0698",
    "published_at": "2026-10-24T09:18:14Z"
  }
}
