{
  "plugin_id": "sakuramedia_javbus_metadata",
  "display_name": "JavBus",
  "description": "JavDB 未收录时，按番号从 JavBus 补全影片标题、发行日期、时长、片商、演员、标签、封面和剧照等元数据。",
  "author": "SakuraMedia",
  "repo": "tinypinglite/sakuramedia_javbus_metadata",
  "homepage": "https://github.com/tinypinglite/sakuramedia_javbus_metadata",
  "categories": [
    "metadata"
  ],
  "official": true,
  "latest": {
    "version": "0.0.3",
    "host_api_version": 12,
    "download_url": "https://github.com/tinypinglite/sakuramedia_javbus_metadata/releases/download/v0.0.3/sakuramedia_javbus_metadata-0.0.3.zip",
    "sha256": "e2fc163f6271a2556bacf65cc8aaeafcf23f1ae5871fde627e8052627787e70f",
    "published_at": "2026-10-29T07:38:39Z"
  },
  "display_name_i18n": {
    "zh-CN": "JavBus",
    "en": "JavBus"
  },
  "description_i18n": {
    "zh-CN": "JavDB 未收录时，按番号从 JavBus 补全影片标题、发行日期、时长、片商、演员、标签、封面和剧照等元数据。",
    "en": "Fills in missing metadata from JavBus by movie number when JavDB has no record: title, release date, duration, studio, cast, tags, cover and stills."
  }
}
