{
  "plugin_id": "sakuramedia_115_provider",
  "display_name": "115 网盘",
  "description": "接入 115 网盘，提供目录浏览、影片导入、115 离线下载、302/后端代理播放、缩略图和片段。",
  "author": "SakuraMedia",
  "repo": "tinypinglite/sakuramedia_115_provider",
  "homepage": "https://github.com/tinypinglite/sakuramedia_115_provider",
  "categories": [
    "storage"
  ],
  "official": true,
  "latest": {
    "version": "0.2.16",
    "host_api_version": 8,
    "download_url": "https://github.com/tinypinglite/sakuramedia_115_provider/releases/download/v0.2.16/sakuramedia_115_provider-0.2.16.zip",
    "sha256": "27082f11e1e6c80fa2c7934b20945683a66390c5d809375c8d45634cc3c28822",
    "published_at": "2026-10-31T03:22:25Z"
  }
}
