{
  "plugin_id": "sakuramedia_local_provider",
  "display_name": "本地存储与 qBittorrent",
  "description": "接入本地媒体目录，提供手动导入、qBittorrent 下载、后端代理播放、缩略图和片段。",
  "author": "SakuraMedia",
  "repo": "tinypinglite/sakuramedia_local_provider",
  "homepage": "https://github.com/tinypinglite/sakuramedia_local_provider",
  "categories": [
    "storage"
  ],
  "official": true,
  "latest": {
    "version": "0.2.7",
    "host_api_version": 10,
    "download_url": "https://github.com/tinypinglite/sakuramedia_local_provider/releases/download/v0.2.7/sakuramedia_local_provider-0.2.7.zip",
    "sha256": "b96509eac6d537fa45a0c12a29c5aaaf28b4fd6e91ff2246ae87d8aac8f61774",
    "published_at": "2026-10-25T06:30:20Z"
  }
}
